"chapter","question","choice1","choice2","choice3","choice4","answer","explanation","explanation1","explanation2","explanation3","explanation4"
"1章：AI","AI効果について、以下の選択肢から適切なものを選べ。","AIの性能が指数関数的に向上する現象","AI導入による経済効果の波及現象","AI技術が普及するにつれて、その存在が当たり前になり、革新性が薄れる現象","AIが学習した結果、自己改善する現象","3","AI効果とは、革新的だったAI技術が普及・標準化されることで、その特異性が失われ「もはやAIではない」と見なされる現象です。","① 性能向上は別問題です。","② 経済効果とは異なります。","③ 正解。普及による慣れが原因です。","④ 自己改善は別の機能です。"
"1章：AI","2045年問題について、以下の選択肢から適切なものを選べ。","レイ・カーツワイルが予測した、AIが人間の知能を超えるシンギュラリティ到来の時期","地球温暖化による環境問題の臨界点","人口動態の転換点","経済危機が顕在化する時期","1","2045年問題は、未来学者レイ・カーツワイルが、AIが人間の知能を超えるシンギュラリティが2045年に訪れると予測したことに関連する議論です。","① 正解。技術的特異点が主題です。","② 環境問題とは無関係です。","③ 人口動態は対象外です。","④ 経済危機とは異なります。"
"1章：AI","レイ・カーツワイルについて、以下の選択肢から適切なものを選べ。","シンギュラリティの概念を最初に提唱した数学者","シンギュラリティ到来を2045年と予測した未来学者","初期のニューラルネットワークの開発者","コンピュータのハードウェア設計者","2","レイ・カーツワイルは、技術の指数関数的発展を予測し、2045年にシンギュラリティが訪れると主張した未来学者です。","① 数学者ではなく未来学者です。","② 正解。シンギュラリティ予測が特徴です。","③ 開発者ではありません。","④ ハードウェア設計は専門外です。"
"1章：AI","ヴァーナー・ヴィンジについて、以下の選択肢から適切なものを選べ。","シンギュラリティの概念を最初に提唱した数学者","ディープラーニングの先駆者","インターネットの発明者","シンギュラリティという概念を広めたSF作家・研究者","4","ヴァーナー・ヴィンジは、シンギュラリティの概念を広めたことで知られるSF作家・研究者であり、技術評論家としても活動しています。","① 数学者とするのは誤りです。","② ディープラーニング先駆者ではありません。","③ インターネット発明者ではありません。","④ 正解。概念普及に寄与しました。"
"1章：AI","シンギュラリティ(技術的特異点)について、以下の選択肢から適切なものを選べ。","コンピュータの処理速度が物理的限界に達する現象","AIが人間の知能を超え、急激な技術革新が起こる転換点","インターネット普及率が臨界点に達する現象","デジタル情報が全て集約される現象","2","シンギュラリティは、AIが人間の知能を超え、予測不可能な急速な技術革新を引き起こす転換点を意味します。","① 物理的処理速度の限界ではありません。","② 正解。知能超越と革新が本質です。","③ インターネット普及とは無関係です。","④ 情報集約とは異なります。"
"2章：生成AI","ALBERT (a Lite BERT)について、以下の選択肢から適切なものを選べ。","画像認識に特化した軽量モデル","BERTを軽量化しつつ同等の性能を維持する言語モデル","音声認識用のコンパクトなモデル","大規模なデータ圧縮を行うモデル","2","ALBERTは、BERTモデルのパラメータを大幅に削減し、計算効率を向上させながらも同等の性能を保つことを目的とした言語モデルです。","① 画像認識は対象外です。","② 正解。軽量化と性能維持が特徴です。","③ 音声認識は目的ではありません。","④ データ圧縮とは異なります。"
"2章：生成AI","RoBERTaについて、以下の選択肢から適切なものを選べ。","BERTの学習手法を改良し、より最適な性能を実現した言語モデル","画像生成に特化したモデル","音声合成用のモデル","テキスト要約専用のモデル","1","RoBERTaは、BERTの学習プロセスを最適化することで、より高い性能を発揮するよう改良された言語モデルです。","① 正解。学習手法の改良が鍵です。","② 画像生成は対象外です。","③ 音声合成は行いません。","④ 特定タスク専用ではありません。"
"2章：生成AI","NSP (Next Sentence Prediction)について、以下の選択肢から適切なものを選べ。","文中の隠された単語を予測するタスク","文章全体の要約を行うタスク","各単語の品詞を予測するタスク","二つの文が元々連続しているかどうかを判断するタスク","4","NSPは、二つの文章が本来連続しているか否かを判断することで、文脈理解を深めるためのBERT事前学習タスクです。","① MLMのタスクです。","② 要約タスクではありません。","③ 品詞予測は別の問題です。","④ 正解。連続性の判定が目的です。"
"2章：生成AI","MLM (Masked Language Model)について、以下の選択肢から適切なものを選べ。","文章中の一部単語を隠し、その単語を予測することで文脈を学習する手法","文章全体の生成を行う手法","文章の要約を作成する手法","各単語の出現確率を直接計算する手法","1","MLMは、文章中の特定の単語をマスクし、隠された単語を予測することで文脈情報を学習する手法です。","① 正解。マスクされた単語予測が目的です。","② 文章生成は別タスクです。","③ 要約は目的外です。","④ 直接計算ではなく予測タスクです。"
"2章：生成AI","BERTモデルについて、以下の選択肢から適切なものを選べ。","一方向の文脈を考慮する事前学習済みモデル","画像認識に特化したTransformerモデル","双方向の文脈を考慮し、豊富な事前学習で文脈理解を実現する言語モデル","機械翻訳専用のTransformerモデル","3","BERTは、Transformerのエンコーダを基盤とし、双方向の文脈情報を活用することで高精度な言語理解を実現するモデルです。","① 一方向ではなく双方向です。","② 画像認識は対象外です。","③ 正解。双方向文脈がBERTの強みです。","④ 機械翻訳専用ではありません。"
"2章：生成AI","Open AIについて、以下の選択肢から適切なものを選べ。","ChatGPTやGPTシリーズを開発したAI研究企業","Googleの親会社","Microsoftの子会社","Metaの研究部門","1","Open AIは、GPTシリーズやChatGPTなどの革新的な言語モデルを開発しているAI研究企業です。","① 正解。先進的な言語モデルが特徴です。","② Googleとは異なります。","③ Microsoftの子会社ではありません。","④ Metaの部門ではありません。"
"2章：生成AI","GPTモデルについて、以下の選択肢から適切なものを選べ。","画像生成を目的としたTransformerモデル","大規模な言語モデルであり、文章生成や理解に優れたTransformerベースのモデル","データ圧縮専用のモデル","分類タスクに特化した小規模モデル","2","GPTモデルは、Transformerのデコーダ構造を用いた大規模な言語モデルで、自然な文章生成や多様な言語タスクに対応します。","① 画像生成は対象外です。","② 正解。自然言語処理に優れたモデルです。","③ 圧縮専用ではありません。","④ 小規模ではありません。"
"2章：生成AI","アーキテクチャについて、以下の選択肢から適切なものを選べ。","システムやモデルの基本設計・構造を定義する概念","具体的なプログラムコードの実装手法","データ保存や管理の方式","ユーザーインターフェースのデザイン手法","1","アーキテクチャは、システムやモデルがどのように構成され、各部がどのように相互作用するかを定義する基本的な設計概念です。","① 正解。基本設計の概念です。","② コード実装とは異なります。","③ データ管理は含みません。","④ UIデザインとは無関係です。"
"2章：生成AI","位置エンコーディングについて、以下の選択肢から適切なものを選べ。","系列データの位置情報を数値的に表現して順序を保持する技術","データ圧縮技術の一種","画像のエンコード方法","音声の特徴抽出技術","1","位置エンコーディングは、Transformerなどのモデルで系列データの順序情報を保持するために、各位置を数値ベクトルに変換する技術です。","① 正解。順序保持が目的です。","② 圧縮技術とは異なります。","③ 画像エンコードは対象外です。","④ 音声特徴抽出とは異なります。"
"2章：生成AI","Attention Mechanismについて、以下の選択肢から適切なものを選べ。","入力の全ての部分に均等な重みを与える機構","出力層でのみ作用する機構","入力中で重要な部分に重点的な重みを割り当て、文脈情報を強調する機構","単にデータの順序を固定するための機構","3","Attention Mechanismは、入力データ中の各部分に動的な重みを付与し、重要な情報を強調することで文脈や依存関係を学習する手法です。","① 均等な重み付けは行いません。","② 出力層だけでなく全層で利用されます。","③ 正解。重要部分に注目する点が本質です。","④ 順序固定が目的ではありません。"
"2章：生成AI","self-attention(自己注意力)について、以下の選択肢から適切なものを選べ。","同一系列内の各要素間の相互関係を計算する機構","外部データとの関連性を評価する機構","固定的な重みを用いるシンプルな注意機構","ランダムに注意を割り当てる手法","1","self-attentionは、同一入力系列内の要素間の関係性を動的に計算し、各要素が他からどれだけ情報を得るかを決定する機構です。","① 正解。内部相互関係の計算が本質です。","② 外部データは対象外です。","③ 重みは動的に計算されます。","④ ランダムな割当てではありません。"
"2章：生成AI","Transformerモデルについて、以下の選択肢から適切なものを選べ。","従来の再帰型ニューラルネットワーク","self-attentionを中核に並列処理が可能な革新的なニューラルネットワークアーキテクチャ","単純なフィードフォワードネットワーク","画像認識専用の畳み込みネットワーク","2","Transformerは、self-attention機構を核とし、並列処理により大規模データの学習が可能な革新的なアーキテクチャです。","① RNNとは異なります。","② 正解。self-attentionが核心です。","③ 単純なFFNではありません。","④ CNNは画像認識向けです。"
"2章：生成AI","LSTM(長・短期記憶)について、以下の選択肢から適切なものを選べ。","長期依存性の学習を可能にする、内部にゲート機構を持つRNN","単純な順伝播型ネットワーク","入力の全要素を均等に扱うRNN","データ保存専用のネットワーク","1","LSTMは、内部にゲート機構を備え、勾配消失問題を回避しながら長期依存性を学習するRNNの一種です。","① 正解。ゲート機構が特徴です。","② 順伝播型とは異なります。","③ 均等処理は行いません。","④ 保存専用ではありません。"
"2章：生成AI","シーケンスデータについて、以下の選択肢から適切なものを選べ。","時系列や文脈を持つ連続的なデータ列","順序に依存しない独立したデータ集合","ランダムに分散したデータ点の集まり","静的な画像データの集合","1","シーケンスデータは、時間的または論理的な順序がある連続的なデータで、テキストや音声、時系列データが含まれます。","① 正解。連続性が重要です。","② 独立データではありません。","③ ランダムな分散ではありません。","④ 画像データは通常対象外です。"
"2章：生成AI","隠れ層について、以下の選択肢から適切なものを選べ。","入力層と出力層の間に位置し、特徴抽出・変換を行う層","データの入力そのものを受け取る層","最終的な結果を生成する層","ネットワーク外部との通信を担当する層","1","隠れ層は、ニューラルネットワークにおいて入力層と出力層の間でデータの特徴抽出や変換を担う中間層です。","① 正解。特徴抽出が主な役割です。","② 入力層とは異なります。","③ 出力層ではありません。","④ 通信は担当しません。"
"2章：生成AI","RNN(回帰型ニューラルネットワーク)について、以下の選択肢から適切なものを選べ。","過去の情報を内部に保持し、時系列データを順次処理するネットワーク","単純な順伝播型ネットワーク","画像データの特徴抽出に特化したネットワーク","大規模データを高速に処理するネットワーク","1","RNNは、前の状態を内部に保持しながら時系列データを逐次処理することで、文脈情報を利用するネットワークです。","① 正解。内部状態保持が特徴です。","② 単純なFFNとは異なります。","③ 画像処理は主にCNNです。","④ 高速処理は主目的ではありません。"
"2章：生成AI","識別器について、以下の選択肢から適切なものを選べ。","新しいデータを生成するモデル","入力データを特定カテゴリーに分類・判別するモデル","データの保存や管理を行うシステム","データを他の形式に変換するシステム","2","識別器は、入力データを解析して特定のカテゴリーに分類・判別するためのモデルです。","① 生成は生成器の役割です。","② 正解。分類・判別が主な機能です。","③ 保存はシステムの役割です。","④ 変換は別の処理です。"
"2章：生成AI","生成機について、以下の選択肢から適切なものを選べ。","入力データを解析し分類するモデル","識別器と同様にデータを分類するモデル","データの保存や検索を行うシステム","学習したデータ分布をもとに新たなデータサンプルを生成するモデル","4","生成機（ジェネレーター）は、学習したデータの分布を捉え、新しいデータを生成することを目的としたモデルです。","① 分類は識別器の役割です。","② 同様ではありません。","③ 保存・検索はシステム機能です。","④ 正解。生成が本質です。"
"2章：生成AI","GAN(敵対的生成ネットワーク)について、以下の選択肢から適切なものを選べ。","生成機と識別器が協力して学習するモデル","単独でデータ生成を行うモデル","生成機と識別器が対立しながら学習し、本物に近いデータ生成を目指すモデル","データ圧縮と再構成を行うモデル","3","GANは、生成機と識別器が敵対的に競い合うことで、双方の性能を向上させ、最終的に高品質なデータ生成を実現するモデルです。","① 敵対ではなく協力ではありません。","② 単独では生成できません。","③ 正解。対立学習が本質です。","④ 圧縮再構成はVAEの特徴です。"
"2章：生成AI","潜在ベクトルについて、以下の選択肢から適切なものを選べ。","高次元データの本質的特徴を低次元空間に圧縮して表現したベクトル","物理的な空間における位置情報を示すベクトル","ランダムに生成されたベクトル集合","データを保存するための固定長符号","1","潜在ベクトルは、高次元データの重要な特徴を低次元に圧縮して表現するもので、データ生成や再構成などに用いられます。","① 正解。特徴抽出と圧縮が目的です。","② 物理的な位置情報とは異なります。","③ ランダムではありません。","④ 保存用符号とは異なります。"
"2章：生成AI","デコーダについて、以下の選択肢から適切なものを選べ。","入力データを圧縮して潜在表現に変換する部分","潜在表現から元のデータ形式へ再構成する部分","学習データを圧縮するアルゴリズム","データのノイズを除去するプロセス","2","デコーダは、エンコーダで得られた潜在表現から、元の入力や望ましい出力形式に再構成する役割を持ちます。","① これはエンコーダの機能です。","② 正解。再構成が目的です。","③ 単なる圧縮アルゴリズムではありません。","④ ノイズ除去は目的外です。"
"2章：生成AI","エンコーダについて、以下の選択肢から適切なものを選べ。","入力データを潜在表現に変換する部分","圧縮されたデータを元に戻す部分","データの特徴を抽出して分類する部分","データを外部に送信する部分","1","エンコーダは、入力データを低次元の潜在表現へと変換し、データの本質的な特徴を抽出するプロセスです。","① 正解。変換と抽出が主な役割です。","② 再構成はデコーダが担当します。","③ 分類は別のタスクです。","④ 送信は関係ありません。"
"2章：生成AI","ノイズについて、以下の選択肢から適切なものを選べ。","データ中の有用な信号","データ処理を促進するための必要な変動","データの主要な特徴","データに含まれる不要な変動や外乱","4","ノイズとは、データ中に含まれる本来の信号ではなく、不要な変動や外乱のことを指し、モデル学習に悪影響を及ぼす可能性があります。","① 有用な信号ではありません。","② 促進するものではありません。","③ 主要な特徴ではありません。","④ 正解。不要な変動を示します。"
"2章：生成AI","VAE(変分自己符号化機)について、以下の選択肢から適切なものを選べ。","データの潜在分布を確率的に学習し、生成と再構成を行う生成モデル","単純なデータ圧縮アルゴリズム","データ分類に特化したディープラーニングモデル","決定論的な自己符号化モデル","1","VAEは、入力データの潜在分布を確率的に学習し、その分布から新たなデータを生成・再構成する生成モデルです。","① 正解。確率的生成と再構成が特徴です。","② 単なる圧縮ではありません。","③ 分類は目的としません。","④ 決定論的ではなく確率的です。"
"2章：生成AI","畳み込みについて、以下の選択肢から適切なものを選べ。","フィルタを用いて入力データから局所的特徴を抽出する数学的操作","単純なデータの加算処理","データの複製を行う操作","データの一部を削除する操作","1","畳み込みは、画像などのデータに対し、フィルタ（カーネル）を適用して局所的な特徴を抽出する基本的な操作です。","① 正解。局所特徴抽出が目的です。","② 単なる加算ではありません。","③ 複製は行いません。","④ 削除操作ではありません。"
"2章：生成AI","自己回帰モデルについて、以下の選択肢から適切なものを選べ。","過去の出力やデータを用いて次の出力を逐次予測するモデル","ランダムな予測を行うモデル","静的な分類を行うモデル","単純な線形回帰モデル","1","自己回帰モデルは、過去のデータや出力を利用して、次に出現する値を予測する時系列予測手法です。","① 正解。逐次予測が特徴です。","② ランダム予測ではありません。","③ 分類は行いません。","④ 線形回帰とは異なります。"
"2章：生成AI","制約付きボルツマンマシンについて、以下の選択肢から適切なものを選べ。","可視層と隠れ層の二層構造を持つ、確率的に学習する生成モデル","決定論的な分類器","データ保存用のシステム","通信プロトコル","1","制約付きボルツマンマシンは、可視層と隠れ層の二層構造を持ち、確率的手法でデータの分布を学習する生成モデルです。","① 正解。二層構造と確率的学習が特徴です。","② 決定論的ではありません。","③ 保存システムではありません。","④ 通信プロトコルとは無関係です。"
"2章：生成AI","ボルツマンマシンについて、以下の選択肢から適切なものを選べ。","エネルギー関数を最小化することで、確率的に学習するネットワーク","決定論的なネットワーク","データベース管理システム","メモリ管理システム","1","ボルツマンマシンは、エネルギー関数の最小化を通じて、確率的にデータの分布を学習するネットワークです。","① 正解。確率的動作が特徴です。","② 決定論的ではありません。","③ データベースとは異なります。","④ メモリ管理とは無関係です。"
"2章：生成AI","生成AI(ジェネレーティブAI)について、以下の選択肢から適切なものを選べ。","既存データを分類するシステム","新しいコンテンツ（テキスト、画像、音声など）を自律的に生成するAIシステム","データを効率的に保存・検索するシステム","情報の抽出に特化したシステム","2","生成AIは、学習したデータの特徴を基に、新たなコンテンツを自律的に生成するAIシステムです。","① 分類は識別器の役割です。","② 正解。自律的生成が本質です。","③ 保存・検索は別の機能です。","④ 抽出は目的が異なります。"
"2章：生成AI","attention層について、以下の選択肢から適切なものを選べ。","入力の重要な部分に注目し、重み付けを行う層構造","単純なデータの平均化を行う層","データを圧縮するための層","ランダムに情報を選択する層","1","attention層は、入力データ中の特に重要な部分に重点を置き、動的に重みを付けることで文脈や依存関係を学習する機構です。","① 正解。重要部分への注目が本質です。","② 平均化は行いません。","③ 圧縮目的ではありません。","④ ランダムな選択は行いません。"
"2章：生成AI","リカレント層について、以下の選択肢から適切なものを選べ。","過去の情報を保持し、時系列データの処理に役立つ再帰的な層","単にデータを一方向に伝達する層","データの保存専用の層","ランダムな出力を生成する層","1","リカレント層は、前時刻の情報を内部に保持し、それを利用して連続するデータの処理を行うため、時系列データの解析に適しています。","① 正解。再帰的情報保持が特徴です。","② 単方向伝達だけではありません。","③ 保存専用ではありません。","④ ランダム出力は生成しません。"
"2章：生成AI","GPT-4について、以下の選択肢から適切なものを選べ。","OpenAIが開発した最新の大規模言語モデルで、高度な自然言語理解と生成能力を持つ","画像認識専用のAIモデル","データベース管理システム","ウェブブラウザの機能を持つシステム","1","GPT-4は、OpenAIが開発した最新世代の大規模言語モデルで、従来を凌駕する言語理解と生成能力を有します。","① 正解。高度な自然言語処理が特徴です。","② 画像認識は対象外です。","③ データベース管理とは異なります。","④ ウェブブラウザではありません。"
