"chapter","question","choice1","choice2","choice3","choice4","answer","explanation","explanation1","explanation2","explanation3","explanation4"
"2章：生成AI","GPT-3.5について、以下の選択肢から適切なものを選べ。","ChatGPTの基盤として利用された大規模言語モデル","画像処理モデル","データ圧縮システム","オペレーティングシステム","1","GPT-3.5は、ChatGPTの初期バージョンの基盤として開発された大規模な言語モデルであり、幅広い言語タスクに対応します。","① 正解。言語モデルとしての役割が重要です。","② 画像処理は対象外です。","③ 圧縮システムではありません。","④ OSとは異なります。"
"2章：生成AI","instructGPTについて、以下の選択肢から適切なものを選べ。","人間の指示に従い、意図に沿った出力を生成するように調整されたGPTモデル","画像生成に特化したGPTモデル","データベース管理システム","ファイル管理システム","1","instructGPTは、人間からの指示に忠実に従うよう最適化されたGPTモデルで、ユーザーが求める回答生成を強化しています。","① 正解。指示への忠実性が特徴です。","② 画像生成は対象外です。","③ データベース管理とは無関係です。","④ ファイル管理は対象外です。"
"2章：生成AI","GPT-3について、以下の選択肢から適切なものを選べ。","当時の最先端を行く大規模言語モデルとして多様なタスクで高性能を示したモデル","小規模な分類モデル","データ保存システム","検索システム","1","GPT-3は、非常に大規模なパラメータを持つ言語モデルとして、自然な文章生成や多様な言語タスクにおいて優れた性能を発揮しました。","① 正解。大規模言語モデルの代表例です。","② 小規模モデルではありません。","③ データ保存システムではありません。","④ 検索システムとは異なります。"
"2章：生成AI","GPT-2について、以下の選択肢から適切なものを選べ。","GPT-3の前身となり、自然な文章生成能力を示した初期の大規模言語モデル","画像認識モデル","データベースシステム","オペレーティングシステム","1","GPT-2は、GPT-3の前身として、自然な文章生成能力を実証し、後続モデルの発展に大きく寄与した言語モデルです。","① 正解。初期大規模モデルとして重要です。","② 画像認識は対象外です。","③ データベースシステムではありません。","④ OSとは無関係です。"
"2章：生成AI","自然言語処理(NLP)について、以下の選択肢から適切なものを選べ。","人間の言語をコンピュータで解析・理解・生成する技術の総称","画像処理技術の一分野","音声合成のみを扱う技術","データ圧縮技術","1","自然言語処理は、人間の言語をコンピュータで処理し、解析、理解、生成を行う技術全般を指し、機械翻訳や対話システムなどに応用されます。","① 正解。言語処理全般を網羅します。","② 画像処理は別分野です。","③ 音声合成は一部に過ぎません。","④ データ圧縮とは関係ありません。"
"2章：生成AI","ChatGPTについて、以下の選択肢から適切なものを選べ。","対話形式で自然な言語生成が可能な、大規模言語モデルベースのAIシステム","単純なキーワード検索エンジン","データベース管理システム","ファイル共有システム","1","ChatGPTは、対話形式でユーザーとの自然なコミュニケーションを実現する大規模言語モデルに基づくAIシステムです。","① 正解。対話型の自然言語生成が特徴です。","② 単なる検索エンジンではありません。","③ データベース管理とは無関係です。","④ ファイル共有は対象外です。"
"3章：現在の生成AIの動向","Luma Dream Machineについて、以下の選択肢から適切なものを選べ。","AIを用いて高品質な動画コンテンツを生成するサービス","テキスト生成に特化したAI","データベース管理システム","音声認識システム","1","Luma Dream Machineは、AI技術を活用してユーザーが高品質な動画を自動生成できるサービスです。","① 正解。動画生成が主な機能です。","② テキスト生成は対象外です。","③ データベース管理は関係ありません。","④ 音声認識は対象外です。"
"3章：現在の生成AIの動向","Runway Gen-3について、以下の選択肢から適切なものを選べ。","テキスト入力から動画を生成する先進的なAIツール","画像編集に特化したソフトウェア","データ分析ツール","ウェブブラウザ","1","Runway Gen-3は、テキストから動画を生成する最新のAIツールで、映像制作の自動化を支援します。","① 正解。テキスト入力から動画生成が特徴です。","② 画像編集は別機能です。","③ データ分析は対象外です。","④ ウェブブラウザではありません。"
"3章：現在の生成AIの動向","Soraについて、以下の選択肢から適切なものを選べ。","OpenAIが開発したテキストから高品質な動画を生成するAIモデル","画像認識システム","データベース","検索エンジン","1","Soraは、OpenAIが開発した、テキスト入力をもとに高品質な動画コンテンツを生成する最先端のAIモデルです。","① 正解。動画生成が主な機能です。","② 画像認識は対象外です。","③ データベースではありません。","④ 検索エンジンとは異なります。"
"3章：現在の生成AIの動向","Geminiについて、以下の選択肢から適切なものを選べ。","Googleが開発した、テキスト、画像、音声など複数のモダリティを扱うマルチモーダルAIモデル","単一のテキスト生成モデル","データ保存システム","ウェブブラウザ","1","Geminiは、Googleが開発した最新のマルチモーダルAIモデルで、テキスト、画像、音声など多様なデータを統合して処理できます。","① 正解。マルチモーダル処理が特徴です。","② 単一モデルではありません。","③ データ保存は対象外です。","④ ウェブブラウザではありません。"
"3章：現在の生成AIの動向","ユーザエクスペリエンスについて、以下の選択肢から適切なものを選べ。","製品やサービス利用時に得られる総合的な体験や感情","システムの技術的仕様","処理速度やパフォーマンスの指標","データの保存容量","1","ユーザエクスペリエンスは、製品やサービスの使用時にユーザーが得る総合的な体験や感情を指し、操作性やデザインが大きな要因となります。","① 正解。利用体験全体が対象です。","② 技術仕様とは異なります。","③ 処理速度は一要素に過ぎません。","④ 保存容量とは関係ありません。"
"3章：現在の生成AIの動向","リマスタリングについて、以下の選択肢から適切なものを選べ。","既存コンテンツを最新技術で改善し、画質や音質を向上させる処理","新規コンテンツの自動生成を行う処理","データの削除や圧縮を行う処理","コンテンツの暗号化を行う処理","1","リマスタリングは、既存の映像や音声コンテンツを最新技術で改善し、品質を向上させるプロセスです。","① 正解。品質向上が目的です。","② 新規生成とは異なります。","③ 削除・圧縮は対象外です。","④ 暗号化は無関係です。"
"3章：現在の生成AIの動向","データ拡張技術について、以下の選択肢から適切なものを選べ。","既存データに対してノイズを加え、多様性を促す手法","既存データを変形・加工して学習データセットを拡張する技術","データ圧縮によって保存量を削減する技術","データの重複を排除する技術","2","データ拡張は、既存データに対して回転、反転、スケーリングなどの変形処理を施し、学習用データセットを人工的に増やす技術です。","① ノイズ追加は一手法ですが、主目的は多様化です。","② 正解。変形加工が本質です。","③ 圧縮は目的が異なります。","④ 重複排除は逆の操作です。"
"3章：現在の生成AIの動向","データの水増し(augmentation)について、以下の選択肢から適切なものを選べ。","既存データに変形処理を加えて学習データセットを拡張する技術","データの圧縮を行い容量を削減する技術","データを削除してノイズを除去する技術","データの暗号化を行う技術","1","データの水増しは、画像などのデータに対し、回転、拡大、反転などの変形処理を施し、人工的に学習データを増やす手法です。","① 正解。データセット拡張が目的です。","② 圧縮は容量削減が目的です。","③ 削除は行いません。","④ 暗号化は無関係です。"
"3章：現在の生成AIの動向","正規化について、以下の選択肢から適切なものを選べ。","データの値を一定の範囲に収め、学習を安定させる前処理技術","データの削除を行う処理","データの複製を行う処理","データの暗号化を行う処理","1","正規化は、データのスケールを統一することで、学習アルゴリズムの収束を安定させ、効率を向上させる前処理技術です。","① 正解。一定範囲への調整が目的です。","② 削除は行いません。","③ 複製は対象外です。","④ 暗号化は無関係です。"
"3章：現在の生成AIの動向","画像のリサイズについて、以下の選択肢から適切なものを選べ。","画像の寸法や解像度を変更する処理","画像の削除を行う処理","画像の暗号化を行う処理","画像の複製を行う処理","1","画像のリサイズは、画像の幅や高さなどの寸法を変更し、用途に合わせた解像度に調整する基本的な処理です。","① 正解。寸法変更が目的です。","② 削除は行いません。","③ 暗号化は対象外です。","④ 複製とは異なります。"
"3章：現在の生成AIの動向","Claudeについて、以下の選択肢から適切なものを選べ。","Anthropic社が開発した高性能な言語モデル","画像生成専用のAI","データベース管理システム","オペレーティングシステム","1","Claudeは、Anthropic社によって開発された高性能な言語モデルで、自然な対話や正確な言語理解が可能です。","① 正解。Anthropic社のモデルです。","② 画像生成は対象外です。","③ データベース管理とは異なります。","④ OSではありません。"
"3章：現在の生成AIの動向","偽情報(ディスインフォメーション)について、以下の選択肢から適切なものを選べ。","意図的に作成され拡散される虚偽の情報","単純な誤解やミスリーディングによる誤情報","システムエラーによる誤った情報","データの欠損による情報の不完全性","1","ディスインフォメーションは、特定の目的のために意図的に作られ拡散される虚偽の情報を指します。","① 正解。意図性が重要です。","② 単なる誤解ではありません。","③ システムエラーは該当しません。","④ 欠損とは異なります。"
"3章：現在の生成AIの動向","ディープフェイク(深層偽造)技術について、以下の選択肢から適切なものを選べ。","AI技術を用いて人物の映像や音声を高度に偽造する技術","単純な画像編集技術","データの暗号化技術","ファイルの圧縮技術","1","ディープフェイクは、深層学習を応用して人物の顔や声を極めてリアルに偽造する技術であり、社会的問題も指摘されています。","① 正解。高度な偽造技術です。","② 単純な編集では表現できません。","③ 暗号化とは無関係です。","④ 圧縮技術ではありません。"
"4章：情報リテラシー・基本理念とAI社会原則","ベーティングについて、以下の選択肢から適切なものを選べ。","人間の好奇心を利用し、USB等を通じてマルウェア感染を誘う攻撃手法","ウイルス対策ソフトの一種","データバックアップ方式","認証システム","1","ベーティングは、好奇心を利用してUSBメモリなどに仕込まれたマルウェアにより感染を誘う攻撃手法です。","① 正解。好奇心を狙った攻撃です。","② ウイルス対策ソフトとは異なります。","③ バックアップ方式ではありません。","④ 認証システムとは無関係です。"
"4章：情報リテラシー・基本理念とAI社会原則","プリテキスティングについて、以下の選択肢から適切なものを選べ。","偽の設定や口実を用いて相手から情報を詐取するソーシャルエンジニアリング手法","データ暗号化方式","認証プロトコル","バックアップシステム","1","プリテキスティングは、架空のシナリオや偽の状況設定を利用して、対象者から機密情報を引き出す手法です。","① 正解。偽の口実が鍵です。","② 暗号化は全く異なります。","③ 認証プロトコルとは関係ありません。","④ バックアップは無関係です。"
"4章：情報リテラシー・基本理念とAI社会原則","個人情報保護委員会について、以下の選択肢から適切なものを選べ。","個人情報保護法に基づく、個人情報の適正な取り扱いを監督する独立行政機関","一般企業","民間団体","研究機関","1","個人情報保護委員会は、個人情報保護法に基づき、個人情報の適切な管理・取り扱いを監督するための政府機関です。","① 正解。独立行政機関として機能します。","② 一般企業ではありません。","③ 民間団体ではありません。","④ 研究機関とは異なります。"
"4章：情報リテラシー・基本理念とAI社会原則","AI社会原則について、以下の選択肢から適切なものを選べ。","AIの開発・利用において、人間中心の価値観、倫理、プライバシー保護などの基本原則を定めたガイドライン","プログラミング規約","システム開発手順","データベース設計指針","1","AI社会原則は、AI技術が社会に与える影響を踏まえ、人間中心の価値観や倫理、プライバシー保護を重視する基本的なガイドラインです。","① 正解。基本原則を示すガイドラインです。","② プログラミング規約とは異なります。","③ 開発手順ではありません。","④ データベース設計は無関係です。"
"5章：テキスト生成AIのプロンプト制作と実例","プロンプトエンジニアリングについて、以下の選択肢から適切なものを選べ。","単にプログラムコードを書く技術","データベースのクエリ設計技術","AIから望ましい結果を引き出すための、入力テキスト（プロンプト）の効果的な設計技術","ネットワーク通信プロトコルの設定技術","3","プロンプトエンジニアリングは、AIに対して適切な指示や質問を与え、期待する応答を得るための入力テキスト設計技術です。","① プログラムコードとは異なります。","② データベースクエリは関係ありません。","③ 正解。効果的なプロンプト設計が鍵です。","④ 通信プロトコルは無関係です。"
"5章：テキスト生成AIのプロンプト制作と実例","Top-pについて、以下の選択肢から適切なものを選べ。","生成時の出力の多様性を制御するための確率的サンプリングパラメータ","プログラムの実行速度を示す指標","メモリ使用量の指標","CPU使用率の指標","1","Top-pは、生成モデルにおいて累積確率がpになる単語候補のみを考慮することで、出力の多様性や創造性を調整するパラメータです。","① 正解。出力の多様性制御が目的です。","② 実行速度とは無関係です。","③ メモリ使用量の指標ではありません。","④ CPU温度とは異なります。"
"5章：テキスト生成AIのプロンプト制作と実例","ハイパーパラメータについて、以下の選択肢から適切なものを選べ。","モデルの学習や推論時に設定する、学習率や層数などの調整可能なパラメータ","プログラムコードそのもの","データ構造の設計情報","ファイル形式や拡張子","1","ハイパーパラメータは、モデルの学習プロセスにおいてあらかじめ設定する必要のあるパラメータで、学習率、バッチサイズ、層数などが含まれます。","① 正解。設定可能な調整値です。","② ソースコードではありません。","③ データ構造とは異なります。","④ ファイル形式は関係ありません。"
"5章：テキスト生成AIのプロンプト制作と実例","プレトレーニングについて、以下の選択肢から適切なものを選べ。","実際のタスクの直前に行われるモデルの学習","大規模データセットを用いて、モデルの基礎知識を事前に学習させる過程","データの保存や管理を行うプロセス","システムの初期化手順","2","プレトレーニングは、特定タスクに入る前に、大規模な一般データを用いてモデルに基礎的な知識を学習させる過程です。","① タスク直前の学習ではありません。","② 正解。基礎学習が目的です。","③ データ保存とは関係ありません。","④ 初期化手順ではありません。"
"5章：テキスト生成AIのプロンプト制作と実例","n-gramモデルについて、以下の選択肢から適切なものを選べ。","連続するn個の単語の出現確率を考慮して次の単語を予測する統計的言語モデル","画像内のピクセル群の出現確率を予測するモデル","データ圧縮アルゴリズムの一種","ファイル管理システム","1","n-gramモデルは、過去n-1個の単語から次に出現する単語の確率を統計的に予測する、言語モデルの基本的な手法です。","① 正解。単語列の確率計算が本質です。","② 画像のピクセルには適用しません。","③ 圧縮アルゴリズムではありません。","④ ファイル管理とは無関係です。"
"5章：テキスト生成AIのプロンプト制作と実例","Temperatureについて、以下の選択肢から適切なものを選べ。","生成テキストの予測性と創造性のバランスを調整するパラメータ","システムの動作温度を示す指標","CPUの物理温度を示す指標","メモリ使用率の指標","1","Temperatureは、生成モデルにおける出力の確率分布の平滑さを調整し、創造性と一貫性のバランスを取るためのパラメータです。","① 正解。出力多様性制御が目的です。","② システム温度とは関係ありません。","③ CPU温度は無関係です。","④ メモリ使用率とは異なります。"
"5章：テキスト生成AIのプロンプト制作と実例","ニューラル言語モデルについて、以下の選択肢から適切なものを選べ。","統計的手法のみを用いる古典的言語モデル","ニューラルネットワークを基盤とし、文脈や意味を学習する現代的な言語モデル","ルールベースのシステム","単純なキーワード抽出に基づくモデル","2","ニューラル言語モデルは、ディープラーニング技術を活用して言語の複雑な文脈や意味を学習する現代的なモデルです。","① 統計的手法のみでは不十分です。","② 正解。ニューラルネットワークが利用されます。","③ ルールベースではありません。","④ キーワード抽出のみでは表現できません。"
"5章：テキスト生成AIのプロンプト制作と実例","プロンプトについて、以下の選択肢から適切なものを選べ。","AIモデルに対して行いたいタスクを指示するための入力テキスト","プログラムコードの一部","システムの設定ファイル","データベースのクエリ文","1","プロンプトは、AIに対して指示や質問を与える入力テキストであり、生成される出力に大きく影響します。","① 正解。タスク指示が本質です。","② プログラムコードとは異なります。","③ システム設定ではありません。","④ クエリ文は対象外です。"
"5章：テキスト生成AIのプロンプト制作と実例","Few-Shotプロンプティングについて、以下の選択肢から適切なものを選べ。","少数の具体例を示してAIの動作を適切に誘導する手法","一切の例示を行わずにタスクを指示する手法","大量の例を用いる手法","ランダムな入力例を与える手法","1","Few-Shotプロンプティングは、少数の具体例を示すことで、AIに対してタスクの意図や形式を明示し、望ましい出力を導く手法です。","① 正解。少数例がキーポイントです。","② 例示なしはZero-Shotです。","③ 大量の例はMany-Shotとなります。","④ ランダムな例示は効果的ではありません。"
"5章：テキスト生成AIのプロンプト制作と実例","Zero-Shotプロンプティングについて、以下の選択肢から適切なものを選べ。","大量の例示を用いてタスクを指示する手法","事前の具体例を一切示さず、直接タスクを指示する手法","全ての可能な例を提示する手法","ランダムに選んだ例を示す手法","2","Zero-Shotプロンプティングは、具体的な例示を行わずに、直接タスクの説明や指示を与える手法です。","① 大量例示はMany-Shotです。","② 正解。例示なしで直接指示します。","③ 全例提示は現実的ではありません。","④ ランダムな例示は意図しません。"
"5章：テキスト生成AIのプロンプト制作と実例","Output Indicatorについて、以下の選択肢から適切なものを選べ。","AIの出力形式やスタイルを指定するための指示子","入力データの形式を指定する指示子","システムの状態を表示するためのインジケータ","エラーメッセージを示すための表示","1","Output Indicatorは、AIが生成する出力の形式やスタイル、特定の構造を指定するための指示子です。","① 正解。出力形式の指定が目的です。","② 入力形式とは異なります。","③ システム状態の表示ではありません。","④ エラー表示とは関係ありません。"
"5章：テキスト生成AIのプロンプト制作と実例","Input Dataについて、以下の選択肢から適切なものを選べ。","AIモデルが処理すべき具体的な入力情報","生成された出力データ","システムの設定情報","エラーログ情報","1","Input Dataは、AIが解析・処理するために与えられる具体的な情報で、プロンプトや各種データそのものを指します。","① 正解。入力として使用される情報です。","② 出力データとは異なります。","③ 設定情報は含まれません。","④ エラーログは対象外です。"
"5章：テキスト生成AIのプロンプト制作と実例","Contextについて、以下の選択肢から適切なものを選べ。","AIが適切な応答を生成するために必要な背景情報や文脈","システムの内部設定情報","エラーメッセージや警告情報","出力形式の具体的指定","1","Contextは、AIが入力プロンプトをより正確に理解し、適切な応答を生成するために参照する背景情報や文脈を指します。","① 正解。背景情報が本質です。","② 内部設定とは異なります。","③ エラーメッセージは対象外です。","④ 出力形式指定とは別です。"
