"chapter","question","choice1","choice2","choice3","choice4","answer","explanation"
"2章：生成AI","エンコーダについて、以下の選択肢から適切なものを選べ","入力データを圧縮された表現に変換する部分","データを復元する部分","データを保存する部分","データを送信する部分","1","エンコーダは、入力データを潜在表現や圧縮された形式に変換する機構です。"
"2章：生成AI","ノイズについて、以下の選択肢から適切なものを選べ","データに含まれる不要な変動や外乱","有用な信号","データの主要な特徴","システムの設定値","1","ノイズは、本来のデータに含まれる不要な変動や外乱で、モデルの性能に影響を与える可能性がある要素です。"
"2章：生成AI","VAE(変分自己符号化機)について、以下の選択肢から適切なものを選べ","確率的な生成モデルで、データの圧縮と生成が可能","単純なデータ圧縮アルゴリズム","データの分類モデル","データの保存システム","1","VAEは、データの確率分布を学習し、潜在空間での表現を通じてデータの生成と再構成を行う生成モデルです。"
"2章：生成AI","畳み込みについて、以下の選択肢から適切なものを選べ","フィルタを使用して特徴を抽出する数学的操作","単純なデータの加算","データの複製","データの削除","1","畳み込みは、入力データにフィルタを適用して特徴を抽出する操作で、特にCNNで重要な役割を果たします。"
"2章：生成AI","自己回帰モデルについて、以下の選択肢から適切なものを選べ","過去の出力を使って次の出力を予測するモデル","ランダム予測モデル","静的分類モデル","単純な線形モデル","1","自己回帰モデルは、系列データにおいて、過去の値を使って将来の値を予測する手法です。"
"2章：生成AI","制約付きボルツマンマシンについて、以下の選択肢から適切なものを選べ","確率的なニューラルネットワークの一種","決定論的な分類器","データ保存システム","通信プロトコル","1","制約付きボルツマンマシンは、確率的な生成モデルで、可視層と隠れ層の二層構造を持つネットワークです。"
"2章：生成AI","ボルツマンマシンについて、以下の選択肢から適切なものを選べ","確率的な挙動を示す再帰型ニューラルネットワーク","決定論的なネットワーク","データベース管理システム","メモリ管理システム","1","ボルツマンマシンは、確率的な動作をする神経網で、エネルギー関数の最小化を通じて学習を行います。"
"2章：生成AI","生成AI(ジェネレーティブAI)について、以下の選択肢から適切なものを選べ","新しいコンテンツを創造できるAIシステム","単純なデータ分類システム","データ保存システム","検索エンジン","1","生成AIは、テキスト、画像、音声など、新しいコンテンツを自律的に生成できるAIシステムです。"
"2章：生成AI","attention層について、以下の選択肢から適切なものを選べ","入力の重要な部分に注目する層構造","単純なデータ処理層","データ保存層","ランダム選択層","1","attention層は、入力データの中で特に重要な部分に焦点を当て、文脈理解を可能にする層構造です。"
"2章：生成AI","リカレント層について、以下の選択肢から適切なものを選べ","過去の情報を考慮できる再帰的な層構造","単純な順伝播層","データ保存層","ランダム処理層","1","リカレント層は、過去の状態を記憶し、時系列データの処理に適した層構造です。"
"2章：生成AI","GPT-4について、以下の選択肢から適切なものを選べ","OpenAIの最新の大規模言語モデル","画像認識専用モデル","データベース管理システム","ウェブブラウザ","1","GPT-4は、GPTシリーズの最新モデルで、より高度な言語理解と生成能力を持つモデルです。"
"2章：生成AI","GPT-3.5について、以下の選択肢から適切なものを選べ","ChatGPTの基盤となった言語モデル","画像処理モデル","データ圧縮システム","オペレーティングシステム","1","GPT-3.5は、ChatGPTの初期バージョンの基盤となった大規模言語モデルです。"
"2章：生成AI","instructGPTについて、以下の選択肢から適切なものを選べ","人間の指示に従うように調整されたGPTモデル","画像生成モデル","データベースシステム","ファイル管理システム","1","instructGPTは、人間の意図をより正確に理解し、指示に従うように最適化されたGPTモデルです。"
"2章：生成AI","GPT-3について、以下の選択肢から適切なものを選べ","1750億個のパラメータを持つ大規模言語モデル","小規模な分類モデル","データ保存システム","検索エンジン","1","GPT-3は、当時最大規模の言語モデルとして注目を集め、様々なタスクで高い性能を示しました。"
"2章：生成AI","GPT-2について、以下の選択肢から適切なものを選べ","GPT-3の前身となった言語モデル","画像認識モデル","データベースシステム","オペレーティングシステム","1","GPT-2は、GPT-3の前身として開発され、自然な文章生成能力を示したモデルです。"
"2章：生成AI","自然言語処理(NLP)について、以下の選択肢から適切なものを選べ","人間の言語を計算機で処理する技術","画像処理技術","音声合成のみの技術","データ圧縮技術","1","NLPは、テキストの理解、生成、翻訳など、人間の言語を扱うAI技術の総称です。"
"2章：生成AI","ChatGPTについて、以下の選択肢から適切なものを選べ","対話形式で高度な言語処理が可能なAIシステム","単純な検索エンジン","データベース管理システム","ファイル共有システム","1","ChatGPTは、自然な対話を通じて様々なタスクをこなすことができる革新的な言語モデルです。"
"3章：現在の生成AIの動向","Luma Dream Machineについて、以下の選択肢から適切なものを選べ","AIを用いた動画生成サービス","テキスト生成AI","データベース管理システム","音声認識システム","1","Luma Dream Machineは、AIを使用して高品質な動画コンテンツを生成できるサービスです。"
"3章：現在の生成AIの動向","Runway Gen-3について、以下の選択肢から適切なものを選べ","テキストから動画を生成できるAIツール","画像編集ソフト","データ分析ツール","ウェブブラウザ","1","Runway Gen-3は、テキスト入力から動画を生成できる先進的なAIツールです。"
"3章：現在の生成AIの動向","Soraについて、以下の選択肢から適切なものを選べ","OpenAIが開発した高度な動画生成AI","画像認識システム","データベース","検索エンジン","1","Soraは、OpenAIが開発した、テキストから高品質な動画を生成できる最新のAIモデルです。"
"3章：現在の生成AIの動向","Geminiについて、以下の選択肢から適切なものを選べ","Googleが開発したマルチモーダルAIモデル","単純な言語モデル","データ保存システム","ウェブブラウザ","1","Geminiは、テキスト、画像、音声など複数のモダリティを扱えるGoogleの最新AIモデルです。"
"3章：現在の生成AIの動向","ユーザエクスペリエンスについて、以下の選択肢から適切なものを選べ","製品やサービスの利用時に得られる総合的な体験","技術的な仕様","システムの処理速度","データの保存容量","1","ユーザエクスペリエンスは、製品やサービスの使用時に得られる体験の質を表す概念です。"
"3章：現在の生成AIの動向","リマスタリングについて、以下の選択肢から適切なものを選べ","既存のコンテンツを高品質化する処理","新規コンテンツの作成","データの削除","ファイルの圧縮","1","リマスタリングは、古いコンテンツを最新の技術で改善し、品質を向上させる処理です。"
"3章：現在の生成AIの動向","データ拡張技術について、以下の選択肢から適切なものを選べ","既存のデータを変形して学習データを増やす技術","データの圧縮技術","データの削除技術","データの暗号化技術","1","データ拡張は、既存のデータに変形を加えて学習データを増やし、モデルの性能を向上させる技術です。"
"3章：現在の生成AIの動向","データの水増し(augmentation)について、以下の選択肢から適切なものを選べ","既存データに変形を加えてデータ量を増やす技術","データの圧縮","データの削除","データの暗号化","1","データの水増しは、回転、反転などの変形を加えてデータセットを拡張する技術です。"
"3章：現在の生成AIの動向","正規化について、以下の選択肢から適切なものを選べ","データを一定の範囲に収める処理","データの削除","データの複製","データの暗号化","1","正規化は、データの値を一定の範囲に収め、モデルの学習を安定させる前処理技術です。"
"3章：現在の生成AIの動向","画像のリサイズについて、以下の選択肢から適切なものを選べ","画像のサイズを変更する処理","画像の削除","画像の暗号化","画像の複製","1","画像のリサイズは、画像の解像度や寸法を目的に応じて変更する処理です。"
"3章：現在の生成AIの動向","Claudeについて、以下の選択肢から適切なものを選べ","Anthropic社が開発した高性能な言語モデル","画像生成専用AI","データベースシステム","オペレーティングシステム","1","Claudeは、高度なコード生成や自然な対話が可能な言語モデルで、特に安全性と倫理性に配慮して開発されています。"
"3章：現在の生成AIの動向","偽情報(ディスインフォメーション)について、以下の選択肢から適切なものを選べ","意図的に作られ拡散される虚偽の情報","単純な誤情報","システムエラー","データの欠損","1","ディスインフォメーションは、特定の目的のために意図的に作成・拡散される虚偽の情報です。"
"3章：現在の生成AIの動向","ディープフェイク(深層偽造)技術について、以下の選択肢から適切なものを選べ","AIを使用して人物の映像や音声を偽造する技術","単純な画像編集","データの暗号化","ファイルの圧縮","1","ディープフェイクは、深層学習を用いて人物の表情や声を高精度に偽造する技術です。"
"4章：情報リテラシー・基本理念とAI社会原則","ベーティングについて、以下の選択肢から適切なものを選べ","人々の好奇心を利用した攻撃手法","ウイルス対策ソフト","データバックアップ方式","認証システム","1","ベーティングは、USBメモリなどを置いて好奇心を刺激し、マルウェア感染を誘う攻撃手法です。"
"4章：情報リテラシー・基本理念とAI社会原則","プリテキスティングについて、以下の選択肢から適切なものを選べ","偽の設定や口実を使って情報を詐取する手法","データ暗号化方式","認証プロトコル","バックアップシステム","1","プリテキスティングは、架空のストーリーを使って相手を騙し、情報を引き出すソーシャルエンジニアリング手法です。"
"4章：情報リテラシー・基本理念とAI社会原則","個人情報保護委員会について、以下の選択肢から適切なものを選べ","個人情報保護法に基づく監督機関","一般企業","民間団体","研究機関","1","個人情報保護委員会は、個人情報の適切な取り扱いを確保し、プライバシー保護を強化するための独立行政委員会です。"
"4章：情報リテラシー・基本理念とAI社会原則","AI社会原則について、以下の選択肢から適切なものを選べ","AIの開発・利用に関する7つの基本原則","プログラミング規約","システム開発手順","データベース設計指針","1","AI社会原則は、人間中心の原則やプライバシー確保など、AIの健全な発展のための7つの基本原則を定めています。"
"5章：テキスト生成AIのプロンプト制作と実例","プロンプトエンジニアリングについて、以下の選択肢から適切なものを選べ","AIに適切な指示を与えるための技術と手法","プログラミング言語","データベース設計","ネットワーク構築","1","プロンプトエンジニアリングは、AIから望ましい結果を得るための効果的な指示の設計技術です。"
"5章：テキスト生成AIのプロンプト制作と実例","Top-pについて、以下の選択肢から適切なものを選べ","生成時の多様性を制御するパラメータ","プログラムの実行速度","メモリ使用量","CPU使用率","1","Top-pは、言語モデルの出力の多様性を制御する確率的サンプリングのパラメータです。"
"5章：テキスト生成AIのプロンプト制作と実例","ハイパーパラメータについて、以下の選択肢から適切なものを選べ","モデルの学習や動作を制御する設定値","プログラムコード","データ構造","ファイル形式","1","ハイパーパラメータは、学習率や層の数など、モデルの学習や動作を制御する重要な設定値です。"
"5章：テキスト生成AIのプロンプト制作と実例","プレトレーニングについて、以下の選択肢から適切なものを選べ","大規模データでモデルを事前学習する過程","実際のタスクでの学習","データの保存過程","システムの初期化","1","プレトレーニングは、特定のタスクの前に大規模なデータで基礎的な学習を行う重要な過程です。"
"5章：テキスト生成AIのプロンプト制作と実例","n-gramモデルについて、以下の選択肢から適切なものを選べ","連続するn個の要素の確率を考慮する言語モデル","画像認識モデル","データ圧縮アルゴリズム","ファイル管理システム","1","n-gramモデルは、直前のn-1個の単語から次の単語の出現確率を予測する統計的言語モデルです。"
"5章：テキスト生成AIのプロンプト制作と実例","Temperatureについて、以下の選択肢から適切なものを選べ","生成テキストの多様性を制御するパラメータ","システムの動作温度","CPUの温度","メモリの使用率","1","Temperatureは、言語モデルの出力の予測性と創造性のバランスを調整するパラメータです。"
"5章：テキスト生成AIのプロンプト制作と実例","ニューラル言語モデルについて、以下の選択肢から適切なものを選べ","ニューラルネットワークを用いた言語モデル","統計的言語モデル","ルールベースモデル","データベースシステム","1","ニューラル言語モデルは、深層学習を用いて言語の構造や意味を学習する現代的な言語モデルです。"
"5章：テキスト生成AIのプロンプト制作と実例","プロンプトについて、以下の選択肢から適切なものを選べ","AIモデルへの入力として与える指示や質問","プログラムコード","システム設定","データベースクエリ","1","プロンプトは、AIモデルに対して何を行って欲しいかを指示するための入力テキストです。"
"5章：テキスト生成AIのプロンプト制作と実例","Few-Shotプロンプティングについて、以下の選択肢から適切なものを選べ","少数の例を示してAIの動作を導く手法","例を示さない手法","大量の例を使用する手法","ランダムな入力を行う手法","1","Few-Shotプロンプティングは、少数の例示を通じてAIの望ましい動作を引き出す手法です。"
"5章：テキスト生成AIのプロンプト制作と実例","Zero-Shotプロンプティングについて、以下の選択肢から適切なものを選べ","例示なしで直接タスクを指示する手法","多数の例を使用する手法","全ての例を使用する手法","ランダムな例を使用する手法","1","Zero-Shotプロンプティングは、事前の例示なしで直接タスクを実行させる手法です。"
"5章：テキスト生成AIのプロンプト制作と実例","Output Indicatorについて、以下の選択肢から適切なものを選べ","AIの出力形式を指定する指示子","入力データの形式","システムの状態表示","エラーメッセージ","1","Output Indicatorは、AIの出力をどのような形式で生成して欲しいかを指定する指示です。"
"5章：テキスト生成AIのプロンプト制作と実例","Input Dataについて、以下の選択肢から適切なものを選べ","AIモデルに与える入力データ","出力データ","システム設定","エラーログ","1","Input Dataは、AIモデルが処理すべき具体的な入力情報を指します。"
"5章：テキスト生成AIのプロンプト制作と実例","Contextについて、以下の選択肢から適切なものを選べ","AIに与える背景情報や文脈","システムの設定情報","エラーメッセージ","出力フォーマット","1","Contextは、AIが適切な応答を生成するために必要な背景情報や状況説明を指します。"